{"expires_at":1791210887,"id":"cap-01a10c6a-c7d8-7a6a-935f-717dc05e16f2","issued_at":1791209687,"issuer":"fcbe38632417bb5b875d49a3c02270633917c6093fd01ebb59ff6416e37afe0c","schema":"chio.capability.v1","scope":{"grants":[{"operations":["invoke"],"server_id":"chio.recovery","tool_name":"create"},{"operations":["invoke"],"server_id":"chio.recovery","tool_name":"inspect"},{"operations":["invoke"],"server_id":"chio.recovery","tool_name":"select"},{"operations":["invoke"],"server_id":"chio.recovery","tool_name":"approve"},{"operations":["invoke"],"server_id":"chio.recovery","tool_name":"resume"},{"operations":["invoke"],"server_id":"chio.recovery","tool_name":"cancel"},{"operations":["invoke"],"server_id":"chio.recovery","tool_name":"report"},{"operations":["invoke"],"server_id":"chio.recovery","tool_name":"settle"},{"operations":["invoke"],"server_id":"chio.recovery","tool_name":"knowledge.read"},{"operations":["invoke"],"server_id":"chio.recovery","tool_name":"knowledge.write"},{"operations":["invoke"],"server_id":"chio.recovery","tool_name":"knowledge.adopt"},{"operations":["invoke"],"server_id":"chio.recovery","tool_name":"knowledge.admin"}]},"signature":"21247573b14f8ec9841cba067faed9f275e977269119e2c7b2474ba54a71102c94c0d819de951fa4f56d7d3e602a96aee3aea211cd7879af5d9c27b3cca27004","subject":"ab3fa2fdab77f98706c76697b42bc99d7b5f967cadcd59c19633ea502fd1dcf3"}